{
  "schemaVersion": "1.0",
  "status": "RESEARCH_VERIFIED / NO_CLONE / NO_INSTALL / RESOURCE_HOLD",
  "generatedAt": "2026-07-20T20:01:22.000Z",
  "baseline": {
    "repository": "/Users/sirinx/SIRINXDev/sirinx-co",
    "branch": "agent/b1-b2-command-center",
    "headSha": "1f05814c3e9d173e525234d69b3ce7f2d1b01a57",
    "workingTree": "DIRTY_USER_OWNED",
    "host": "Mac14,3",
    "memoryGiB": 8,
    "logicalCpuCount": 8,
    "freeDiskKiB": 14268520,
    "workloadFloorKiB": 15728640,
    "fullChainTargetKiB": 20971520,
    "resourceAdmission": "HOLD_BELOW_15_GIB"
  },
  "authority": {
    "approvalSource": "attested-human-operator-exact-ticket",
    "installGrantPresent": false,
    "connectorGrantPresent": false,
    "providerGrantPresent": false,
    "cloudflareMutationGrantPresent": false,
    "liveSendGrantPresent": false
  },
  "licensePolicy": {
    "allowedSpdx": ["Apache-2.0", "MIT"],
    "unknownMeans": "INELIGIBLE",
    "evidenceRequirement": "publisher-controlled-license-file-or-model-card"
  },
  "components": [
    {
      "id": "cloudflare-agents",
      "category": "MCP_SDK",
      "name": "Cloudflare Agents SDK",
      "publisher": "cloudflare",
      "sourceUrl": "https://github.com/cloudflare/agents",
      "licenseSpdx": ["MIT"],
      "licenseEvidenceUrl": "https://github.com/cloudflare/agents/blob/main/LICENSE",
      "permissiveLicenseVerified": true,
      "sourceVerification": "PRIMARY_SOURCE_VERIFIED",
      "revisionPolicy": "PIN_EXACT_STABLE_RELEASE",
      "selectedRevision": null,
      "selectedArtifact": null,
      "disposition": "CANDIDATE_RESOURCE_HELD",
      "installationState": "NOT_INSTALLED",
      "overlapDecision": "FILL_GAP",
      "resourceFit": {
        "downloadGiB": null,
        "fitsEightGiBHost": null,
        "decisionBasis": "Stateless createMcpHandler preview is preferred; exact dependency and post-install footprint are not measured."
      },
      "securityNotes": [
        "Use Streamable HTTP and stateless createMcpHandler for the first documentation-only preview.",
        "McpAgent and Durable Objects remain held until state, tenancy, retention, deletion, and migration review."
      ],
      "requiredTickets": ["INSTALL", "CONNECTOR_ACTIVATION", "CLOUDFLARE_MUTATION", "DEPLOY"],
      "officialSources": [
        "https://developers.cloudflare.com/agents/model-context-protocol/guides/remote-mcp-server/",
        "https://github.com/cloudflare/agents"
      ],
      "installReady": false,
      "canClone": false,
      "canInstall": false,
      "canRun": false,
      "canConnect": false
    },
    {
      "id": "cloudflare-api-code-mode-mcp",
      "category": "MCP_SERVER",
      "name": "Cloudflare API Code Mode MCP",
      "publisher": "cloudflare",
      "sourceUrl": "https://github.com/cloudflare/mcp",
      "licenseSpdx": ["Apache-2.0"],
      "licenseEvidenceUrl": "https://github.com/cloudflare/mcp/blob/main/LICENSE",
      "permissiveLicenseVerified": true,
      "sourceVerification": "PRIMARY_SOURCE_VERIFIED",
      "revisionPolicy": "REFERENCE_ONLY",
      "selectedRevision": null,
      "selectedArtifact": null,
      "disposition": "REFERENCE_ONLY",
      "installationState": "REFERENCE_ONLY",
      "overlapDecision": "DO_NOT_ADD_OVERLAP",
      "resourceFit": {
        "downloadGiB": null,
        "fitsEightGiBHost": null,
        "decisionBasis": "Footprint is irrelevant while its broad search and execute API surface remains quarantined."
      },
      "securityNotes": [
        "The server can expose mutating Workers, KV, R2, DNS, and other account APIs.",
        "Do not use as the first SIRINX MCP connection or treat search plus execute as read-only."
      ],
      "requiredTickets": ["CONNECTOR_ACTIVATION", "CLOUDFLARE_MUTATION"],
      "officialSources": ["https://github.com/cloudflare/mcp"],
      "installReady": false,
      "canClone": false,
      "canInstall": false,
      "canRun": false,
      "canConnect": false
    },
    {
      "id": "modelcontextprotocol-rust-sdk",
      "category": "MCP_SDK",
      "name": "Official MCP Rust SDK (rmcp)",
      "publisher": "modelcontextprotocol",
      "sourceUrl": "https://github.com/modelcontextprotocol/rust-sdk",
      "licenseSpdx": ["Apache-2.0", "MIT"],
      "licenseEvidenceUrl": "https://github.com/modelcontextprotocol/rust-sdk/blob/main/LICENSE",
      "permissiveLicenseVerified": true,
      "sourceVerification": "PRIMARY_SOURCE_VERIFIED",
      "revisionPolicy": "PIN_EXACT_STABLE_RELEASE",
      "selectedRevision": "rmcp-v2.2.0",
      "selectedArtifact": null,
      "disposition": "CANDIDATE_AUTHORITY_HELD",
      "installationState": "NOT_INSTALLED",
      "overlapDecision": "OPTIONAL",
      "resourceFit": {
        "downloadGiB": null,
        "fitsEightGiBHost": true,
        "decisionBasis": "Native Rust fit is strong, but exact Cargo feature and compiled-footprint receipts are absent."
      },
      "securityNotes": [
        "Prefer minimal server and Streamable HTTP features only.",
        "OAuth, child-process, and client transports materially expand authority and remain disabled."
      ],
      "requiredTickets": ["INSTALL", "CONNECTOR_ACTIVATION"],
      "officialSources": ["https://github.com/modelcontextprotocol/rust-sdk"],
      "installReady": false,
      "canClone": false,
      "canInstall": false,
      "canRun": false,
      "canConnect": false
    },
    {
      "id": "modelcontextprotocol-specification",
      "category": "MCP_SPEC",
      "name": "Model Context Protocol specification",
      "publisher": "modelcontextprotocol",
      "sourceUrl": "https://github.com/modelcontextprotocol/modelcontextprotocol",
      "licenseSpdx": ["MIT"],
      "licenseEvidenceUrl": "https://github.com/modelcontextprotocol/modelcontextprotocol/blob/main/LICENSE",
      "permissiveLicenseVerified": true,
      "sourceVerification": "PRIMARY_SOURCE_VERIFIED",
      "revisionPolicy": "REFERENCE_ONLY",
      "selectedRevision": "2025-11-25",
      "selectedArtifact": null,
      "disposition": "REFERENCE_ONLY",
      "installationState": "REFERENCE_ONLY",
      "overlapDecision": "NOT_APPLICABLE",
      "resourceFit": {
        "downloadGiB": 0,
        "fitsEightGiBHost": true,
        "decisionBasis": "Protocol reference only; no runtime installation is required."
      },
      "securityNotes": [
        "Streamable HTTP is the current transport; legacy HTTP plus SSE is deprecated.",
        "Require PKCE S256, resource binding, audience validation, Origin validation, and no token passthrough."
      ],
      "requiredTickets": [],
      "officialSources": [
        "https://modelcontextprotocol.io/docs/learn/versioning",
        "https://modelcontextprotocol.io/specification/2025-11-25/basic/transports",
        "https://modelcontextprotocol.io/specification/2025-11-25/basic/authorization"
      ],
      "installReady": false,
      "canClone": false,
      "canInstall": false,
      "canRun": false,
      "canConnect": false
    },
    {
      "id": "a2a-specification",
      "category": "A2A_SPEC",
      "name": "Agent2Agent protocol specification",
      "publisher": "a2aproject",
      "sourceUrl": "https://github.com/a2aproject/A2A",
      "licenseSpdx": ["Apache-2.0"],
      "licenseEvidenceUrl": "https://github.com/a2aproject/A2A/blob/main/LICENSE",
      "permissiveLicenseVerified": true,
      "sourceVerification": "PRIMARY_SOURCE_VERIFIED",
      "revisionPolicy": "REFERENCE_ONLY",
      "selectedRevision": "v1.0.1-source / 1.0-wire",
      "selectedArtifact": null,
      "disposition": "REFERENCE_ONLY",
      "installationState": "REFERENCE_ONLY",
      "overlapDecision": "NOT_APPLICABLE",
      "resourceFit": {
        "downloadGiB": 0,
        "fitsEightGiBHost": true,
        "decisionBasis": "Protocol reference only."
      },
      "securityNotes": [
        "An Agent Card is untrusted topology data until origin and optional signature trust are verified.",
        "SIRINX heartbeat, lease, circuit, and receipt requirements are an admission overlay, not normative A2A requirements."
      ],
      "requiredTickets": [],
      "officialSources": [
        "https://github.com/a2aproject/A2A/releases",
        "https://a2a-protocol.org/latest/specification/"
      ],
      "installReady": false,
      "canClone": false,
      "canInstall": false,
      "canRun": false,
      "canConnect": false
    },
    {
      "id": "a2a-javascript-sdk",
      "category": "A2A_SDK",
      "name": "Official A2A JavaScript SDK",
      "publisher": "a2aproject",
      "sourceUrl": "https://github.com/a2aproject/a2a-js",
      "licenseSpdx": ["Apache-2.0"],
      "licenseEvidenceUrl": "https://github.com/a2aproject/a2a-js/blob/main/LICENSE",
      "permissiveLicenseVerified": true,
      "sourceVerification": "PRIMARY_SOURCE_VERIFIED",
      "revisionPolicy": "PIN_EXACT_STABLE_RELEASE",
      "selectedRevision": "v0.3.14",
      "selectedArtifact": null,
      "disposition": "HOLD_PROTOCOL_VERSION",
      "installationState": "NOT_INSTALLED",
      "overlapDecision": "FILL_GAP",
      "resourceFit": {
        "downloadGiB": null,
        "fitsEightGiBHost": true,
        "decisionBasis": "Node fit is plausible; exact dependency and installed footprint are not measured."
      },
      "securityNotes": [
        "Stable SDK is protocol 0.3; v1 support is beta and the v1 TCK is alpha.",
        "Do not satisfy a SIRINX A2A v1 gate with the stable 0.3 SDK."
      ],
      "requiredTickets": ["INSTALL", "CONNECTOR_ACTIVATION", "A2A_EGRESS"],
      "officialSources": [
        "https://github.com/a2aproject/a2a-js/releases",
        "https://github.com/a2aproject/a2a-tck"
      ],
      "installReady": false,
      "canClone": false,
      "canInstall": false,
      "canRun": false,
      "canConnect": false
    },
    {
      "id": "a2a-rust-sdk",
      "category": "A2A_SDK",
      "name": "Official A2A Rust SDK",
      "publisher": "a2aproject",